{
  "feature_name": "회원가입",
  "requirement_summary": "신규 사용자는 이름, 이메일, 비밀번호를 입력하여 회원가입할 수 있으며, 입력값 검증 및 중복 이메일 체크를 통해 계정을 생성한다.",
  "priority": "P0",
  "risk_level": "High",
  "preconditions": [
    "회원가입 페이지에 접근 가능한 상태",
    "테스트용 이메일 주소 'test_new_user@example.com'이 DB에 등록되지 않은 상태",
    "중복 테스트용 이메일 'duplicate@example.com'이 DB에 이미 등록된 상태",
    "네트워크 연결 정상 상태"
  ],
  "test_steps": [
    "회원가입 페이지로 이동한다.",
    "이름 입력란에 '홍길동'을 입력한다.",
    "이메일 입력란에 'test_new_user@example.com'을 입력한다.",
    "비밀번호 입력란에 'Password123!'을 입력한다.",
    "회원가입 버튼을 클릭한다.",
    "회원가입 성공 메시지 및 화면 전환을 확인한다."
  ],
  "expected_results": [
    "회원가입 버튼 클릭 후 3초 이내 응답이 반환된다.",
    "화면에 '회원가입이 완료되었습니다' 또는 '환영합니다' 메시지가 표시된다.",
    "로그인 페이지 또는 메인 페이지로 자동 이동된다.",
    "DB에 신규 사용자 레코드가 생성되며 이메일이 'test_new_user@example.com'으로 저장된다.",
    "비밀번호는 암호화되어 저장된다."
  ],
  "negative_cases": [
    "이름을 입력하지 않고 회원가입 시도 시 '이름을 입력해주세요' 메시지 표시",
    "이메일을 입력하지 않고 회원가입 시도 시 '이메일을 입력해주세요' 메시지 표시",
    "비밀번호를 입력하지 않고 회원가입 시도 시 '비밀번호를 입력해주세요' 메시지 표시",
    "모든 필드를 공백으로 입력 후 회원가입 시도 시 각 필드별 필수 입력 오류 메시지 표시",
    "이미 가입된 이메일 'duplicate@example.com' 입력 시 '이미 사용 중인 이메일입니다' 메시지 표시 및 회원가입 차단",
    "비밀번호 7자 'Pass123' 입력 시 '비밀번호는 최소 8자 이상이어야 합니다' 메시지 표시",
    "잘못된 이메일 형식 'invalid-email' 입력 시 '올바른 이메일 형식을 입력해주세요' 메시지 표시",
    "잘못된 이메일 형식 'test@' 입력 시 이메일 유효성 검사 실패 메시지 표시",
    "SQL Injection 시도 \"admin' OR '1'='1\" 입력 시 입력값 검증 실패 또는 안전하게 처리",
    "XSS 공격 시도 '<script>alert(1)</script>' 입력 시 스크립트 실행 차단 및 안전한 문자열로 처리"
  ],
  "edge_cases": [
    "비밀번호 정확히 8자 'Pass1234' 입력 시 회원가입 성공",
    "비밀번호 최대 길이 128자 입력 시 회원가입 성공 여부 확인",
    "이름에 특수문자 포함 '홍길동!' 입력 시 허용 여부 확인",
    "이름 1자 '홍' 입력 시 회원가입 성공 여부 확인",
    "이름 100자 초과 입력 시 입력 제한 또는 오류 메시지 표시",
    "이메일 최대 길이 254자 입력 시 회원가입 처리 확인",
    "대소문자가 다른 동일 이메일 'Test@example.com'과 'test@example.com' 중복 처리 확인",
    "회원가입 버튼 연속 2회 클릭 시 중복 계정 생성 방지 확인",
    "[Regression] 회원가입 후 즉시 동일 이메일로 재가입 시도 시 중복 이메일 오류 발생 확인",
    "[Regression] 회원가입 성공 후 로그인 기능 정상 동작 확인",
    "회원가입 진행 중 네트워크 단절 시 타임아웃 처리 및 적절한 오류 메시지 표시",
    "회원가입 API 호출 중 브라우저 새로고침 시 중복 요청 방지 확인",
    "회원가입 폼 입력 중 → 페이지 이탈 → 재진입 시 입력값 초기화 확인"
  ],
  "non_functional_checks": [
    "회원가입 API 응답시간 3초 이내 확인",
    "동시 100명 회원가입 요청 시 시스템 안정성 확인",
    "비밀번호 평문 노출 여부 확인 (화면 표시 시 마스킹, 네트워크 전송 시 암호화)",
    "회원가입 실패 시에도 사용자 친화적 오류 메시지 표시 확인",
    "모바일 환경에서 회원가입 화면 UI 정상 표시 확인"
  ],
  "test_data": [
    {
      "scenario": "정상 회원가입",
      "name": "홍길동",
      "email": "test_new_user@example.com",
      "password": "Password123!"
    },
    {
      "scenario": "중복 이메일",
      "name": "김철수",
      "email": "duplicate@example.com",
      "password": "SecurePass456!"
    },
    {
      "scenario": "짧은 비밀번호",
      "name": "이영희",
      "email": "valid_email@example.com",
      "password": "Pass123"
    },
    {
      "scenario": "잘못된 이메일 형식",
      "name": "박민수",
      "email": "invalid-email",
      "password": "ValidPass123!"
    },
    {
      "scenario": "경계값 비밀번호 8자",
      "name": "최지우",
      "email": "boundary_test@example.com",
      "password": "Pass1234"
    }
  ],
  "traceability": [
    "REQ-SIGNUP-001: 사용자는 이름, 이메일, 비밀번호를 입력하여 회원가입할 수 있어야 한다",
    "REQ-SIGNUP-002: 이름, 이메일, 비밀번호는 필수 입력값이어야 한다",
    "REQ-SIGNUP-003: 이미 가입된 이메일은 사용할 수 없어야 한다",
    "REQ-SIGNUP-004: 비밀번호는 최소 8자 이상이어야 한다",
    "REQ-SIGNUP-005: 이메일 형식이 올바르지 않으면 유효성 검사 메시지를 표시해야 한다",
    "REQ-SIGNUP-006: 모든 입력값이 유효하면 회원가입에 성공해야 한다",
    "REQ-SIGNUP-007: 회원가입 성공 시 환영 메시지 또는 로그인 유도 메시지를 보여줘야 한다"
  ],
  "automation_candidate": true,
  "notes": [
    "회원가입은 서비스 진입의 핵심 기능으로 P0 우선순위 지정",
    "중복 이메일 체크는 DB 조회가 필요하므로 테스트 환경에서 사전 데이터 준비 필수",
    "비밀번호 암호화 저장 여부는 DB 직접 조회를 통해 검증 필요",
    "[Regression] 기존 로그인 기능과의 통합 테스트 필수 - 회원가입 후 즉시 로그인 가능 여부 확인",
    "[Regression] 기존 이메일 중복 체크 로직이 신규 배포에서도 정상 동작하는지 BVT 수행 필요",
    "보안 테스트: SQL Injection, XSS 공격 시나리오 포함",
    "자동화 우선 대상: 정상 케이스, 필수값 누락, 중복 이메일, 비밀번호 길이 검증"
  ]
}