{
  "feature_name": "사용자 로그인",
  "requirement_summary": "등록된 사용자는 이메일과 비밀번호를 입력하여 서비스에 로그인할 수 있으며, 입력값 검증 및 인증 실패 시 명확한 오류 메시지를 제공받는다.",
  "priority": "P0",
  "risk_level": "High",
  "preconditions": [
    "테스트 계정이 DB에 등록되어 있어야 함 (이메일: test@example.com, 비밀번호: Test1234!)",
    "로그인 페이지에 접근 가능한 상태여야 함",
    "브라우저 쿠키 및 세션이 초기화된 상태여야 함",
    "네트워크 연결이 정상 상태여야 함"
  ],
  "test_steps": [
    "로그인 페이지로 이동한다",
    "이메일 입력 필드에 'test@example.com'을 입력한다",
    "비밀번호 입력 필드에 'Test1234!'를 입력한다",
    "로그인 버튼을 클릭한다",
    "페이지 이동 및 세션 생성을 확인한다"
  ],
  "expected_results": [
    "로그인 버튼 클릭 후 3초 이내에 메인 페이지 또는 대시보드로 리다이렉트된다",
    "페이지 상단에 사용자 이름 또는 이메일이 표시된다",
    "브라우저 쿠키에 인증 토큰이 저장된다",
    "로그인 페이지로 다시 접근 시 자동으로 메인 페이지로 리다이렉트된다",
    "비밀번호 입력 필드는 마스킹 처리(•••)되어 평문이 노출되지 않는다"
  ],
  "negative_cases": [
    "잘못된 비밀번호 입력 시 '이메일 또는 비밀번호가 올바르지 않습니다' 메시지가 표시되고 로그인이 실패한다",
    "존재하지 않는 이메일 입력 시 '이메일 또는 비밀번호가 올바르지 않습니다' 메시지가 표시되고 로그인이 실패한다",
    "이메일 필드를 비운 채 로그인 버튼 클릭 시 '이메일을 입력해주세요' 검증 메시지가 표시된다",
    "비밀번호 필드를 비운 채 로그인 버튼 클릭 시 '비밀번호를 입력해주세요' 검증 메시지가 표시된다",
    "이메일 형식이 아닌 값(예: 'testexample.com') 입력 시 '올바른 이메일 형식이 아닙니다' 메시지가 표시된다",
    "연속 5회 로그인 실패 시 계정 잠금 또는 CAPTCHA 인증 요구 메시지가 표시된다",
    "SQL Injection 시도(예: ' OR '1'='1) 시 로그인이 차단되고 정상적인 오류 메시지가 표시된다"
  ],
  "edge_cases": [
    "이메일 입력 시 앞뒤 공백 포함(예: ' test@example.com ') 시 공백을 trim 처리하여 정상 로그인된다",
    "비밀번호 앞뒤 공백 입력 시 공백을 포함한 그대로 인증하여 실패 처리된다",
    "Caps Lock이 켜진 상태에서 비밀번호 입력 시 Caps Lock 경고 메시지가 표시된다",
    "로그인 버튼을 연속으로 빠르게 클릭(Double Submit) 시 중복 요청이 방지되고 1회만 처리된다",
    "로그인 처리 중 네트워크가 끊긴 경우 타임아웃 에러 메시지가 표시되고 페이지가 비정상 종료되지 않는다",
    "세션 만료 후 재로그인 시 이전 페이지로 자동 리다이렉트된다",
    "[Regression] 로그아웃 후 재로그인 시 세션이 정상적으로 재생성되고 이전 세션 데이터가 남아있지 않다",
    "[Regression] 비밀번호 변경 후 이전 비밀번호로 로그인 시도 시 로그인이 실패한다",
    "매우 긴 이메일(254자) 입력 시 정상 처리되거나 명확한 길이 제한 메시지가 표시된다",
    "매우 긴 비밀번호(128자) 입력 시 정상 처리되거나 명확한 길이 제한 메시지가 표시된다"
  ],
  "non_functional_checks": [
    "로그인 API 응답 시간이 1초 이내여야 한다",
    "비밀번호는 HTTPS를 통해 암호화되어 전송되어야 한다",
    "로그인 실패 로그가 서버에 기록되어야 한다",
    "동시 100명의 사용자가 로그인 시도 시 성공률 99% 이상이어야 한다",
    "브라우저 개발자 도구 Network 탭에서 비밀번호 평문이 노출되지 않아야 한다"
  ],
  "test_data": [
    {
      "case": "정상 로그인",
      "email": "test@example.com",
      "password": "Test1234!",
      "expected": "성공"
    },
    {
      "case": "잘못된 비밀번호",
      "email": "test@example.com",
      "password": "WrongPass123!",
      "expected": "실패"
    },
    {
      "case": "존재하지 않는 이메일",
      "email": "nonexistent@example.com",
      "password": "Test1234!",
      "expected": "실패"
    },
    {
      "case": "이메일 형식 오류",
      "email": "invalidemail",
      "password": "Test1234!",
      "expected": "검증 실패"
    },
    {
      "case": "빈 이메일",
      "email": "",
      "password": "Test1234!",
      "expected": "검증 실패"
    },
    {
      "case": "빈 비밀번호",
      "email": "test@example.com",
      "password": "",
      "expected": "검증 실패"
    },
    {
      "case": "공백 포함 이메일",
      "email": " test@example.com ",
      "password": "Test1234!",
      "expected": "성공(trim 처리)"
    }
  ],
  "traceability": [
    "REQ-LOGIN-001: 이메일과 비밀번호 입력 필드 제공",
    "REQ-LOGIN-002: 올바른 인증 정보 입력 시 로그인 성공",
    "REQ-LOGIN-003: 로그인 성공 시 메인 페이지로 이동",
    "REQ-LOGIN-004: 잘못된 비밀번호 입력 시 로그인 실패",
    "REQ-LOGIN-005: 존재하지 않는 이메일 입력 시 로그인 실패",
    "REQ-LOGIN-006: 이메일 형식 검증 및 오류 메시지 표시",
    "REQ-LOGIN-007: 필수 입력값 누락 시 검증 메시지 표시",
    "REQ-LOGIN-008: 비밀번호 마스킹 처리",
    "REQ-LOGIN-009: 인증 실패 시 페이지 비정상 종료 방지"
  ],
  "automation_candidate": true,
  "notes": [
    "P0 기능으로 매 릴리즈 시 필수 회귀 테스트 대상",
    "보안 취약점 점검을 위해 SQL Injection, XSS 테스트 포함 필요",
    "로그인은 서비스 진입점이므로 장애 시 전체 사용자 이탈 가능",
    "브라우저별(Chrome, Safari, Firefox, Edge) 크로스 브라우징 테스트 권장",
    "모바일 환경에서도 동일한 테스트 시나리오 실행 필요",
    "[Regression] 비밀번호 변경, 계정 탈퇴 후 재가입 시나리오와 연계 테스트 필요",
    "성능 테스트: 피크 시간대 동시 접속 부하 테스트 별도 수행 권장"
  ]
}