{
  "feature_name": "장바구니 관리",
  "requirement_summary": "사용자는 상품을 장바구니에 담고, 수량을 변경하거나 삭제할 수 있으며, 장바구니 상태는 실시간으로 화면에 반영되어야 한다.",
  "priority": "P0",
  "risk_level": "High",
  "preconditions": [
    "사용자가 로그인된 상태여야 한다",
    "최소 1개 이상의 판매 가능한 상품이 존재해야 한다",
    "장바구니 서비스가 정상 동작 중이어야 한다",
    "테스트 계정: test_user_001, 비밀번호: Test1234!",
    "테스트 상품: 상품ID PRD-001 (재고 100개), PRD-002 (재고 5개), PRD-003 (품절)"
  ],
  "test_steps": [
    "상품 상세 페이지(PRD-001)로 이동한다",
    "장바구니 담기 버튼을 클릭한다",
    "장바구니 페이지로 이동하여 상품이 추가되었는지 확인한다",
    "동일 상품 상세 페이지로 돌아가 장바구니 담기 버튼을 다시 클릭한다",
    "장바구니 페이지에서 수량이 2개로 증가했는지 확인한다",
    "수량 변경 입력란에 5를 입력하고 변경 버튼을 클릭한다",
    "수량이 5개로 변경되고 총 금액이 재계산되었는지 확인한다",
    "삭제 버튼을 클릭한다",
    "해당 상품이 장바구니에서 제거되고 빈 장바구니 메시지가 표시되는지 확인한다"
  ],
  "expected_results": [
    "장바구니 담기 클릭 시 '장바구니에 추가되었습니다' 메시지가 표시되고 장바구니 아이콘 배지 숫자가 1 증가한다",
    "장바구니 페이지에서 PRD-001 상품명, 가격, 수량 1개가 정확히 표시된다",
    "동일 상품 재추가 시 새 항목이 생성되지 않고 기존 항목의 수량이 2개로 증가한다",
    "수량을 5로 변경 시 2초 이내에 화면에 수량 5가 반영되고 총 금액이 (상품 단가 × 5)로 업데이트된다",
    "삭제 버튼 클릭 시 해당 상품 항목이 목록에서 제거된다",
    "장바구니가 비었을 때 '장바구니가 비어 있습니다' 메시지와 쇼핑 계속하기 버튼이 표시된다",
    "모든 장바구니 변경 사항은 페이지 새로고침 후에도 유지된다"
  ],
  "negative_cases": [
    "품절 상품(PRD-003)을 장바구니에 담으려 하면 '현재 품절된 상품입니다' 에러 메시지가 표시되고 장바구니에 추가되지 않는다",
    "수량 입력란에 0을 입력하면 '1개 이상 입력해주세요' 메시지가 표시되거나 삭제 확인 팝업이 표시된다",
    "수량 입력란에 음수(-5)를 입력하면 입력이 차단되거나 '올바른 수량을 입력해주세요' 에러 메시지가 표시된다",
    "수량 입력란에 문자열('abc')을 입력하면 입력이 차단되거나 에러 메시지가 표시된다",
    "재고보다 많은 수량(150개)을 입력하면 '재고가 부족합니다. (최대 100개)' 메시지가 표시되고 변경이 거부된다",
    "로그아웃 상태에서 장바구니 담기 클릭 시 로그인 페이지로 리다이렉트되거나 로그인 유도 메시지가 표시된다",
    "동시에 여러 상품의 수량 변경 요청을 보냈을 때 모든 요청이 순차적으로 처리되고 데이터 정합성이 유지된다"
  ],
  "edge_cases": [
    "장바구니에 상품 100개를 담고 수량을 최대값으로 변경했을 때 정상 처리되고 UI가 깨지지 않는다",
    "수량을 1로 설정한 상태에서 감소 버튼을 클릭하면 삭제 확인 팝업이 표시되거나 자동으로 삭제된다",
    "장바구니 페이지에서 수량 변경 중 네트워크가 끊겼다가 복구되면 마지막 저장된 상태로 롤백되거나 재시도 옵션이 제공된다",
    "다른 브라우저 또는 디바이스에서 동일 계정으로 장바구니 수정 시 현재 페이지에서도 동기화된다 (또는 새로고침 시 반영)",
    "상품을 장바구니에 담은 후 해당 상품이 관리자에 의해 품절 처리되면 장바구니에서 품절 표시가 나타나고 주문 진행이 차단된다",
    "[Regression] 장바구니에 상품이 담긴 상태에서 로그아웃 후 재로그인 시 장바구니 내용이 유지된다",
    "[Regression] 장바구니에서 상품 삭제 후 동일 상품을 다시 담으면 수량 1로 새로 추가된다",
    "[Regression] 장바구니 페이지에서 상품명 클릭 시 해당 상품 상세 페이지로 이동하고 뒤로가기 시 장바구니로 정상 복귀한다",
    "장바구니 API 응답이 5초 이상 지연될 때 로딩 인디케이터가 표시되고 타임아웃 처리가 적절히 동작한다",
    "장바구니에 재고 5개인 상품(PRD-002)을 5개 담은 상태에서 6개로 변경 시도 시 재고 부족 에러가 발생한다"
  ],
  "non_functional_checks": [
    "장바구니 담기 버튼 클릭 후 2초 이내에 결과가 화면에 반영되어야 한다",
    "장바구니 페이지 로딩 시간은 3초를 초과하지 않아야 한다",
    "장바구니에 상품 50개가 담긴 상태에서도 수량 변경이 2초 이내에 처리되어야 한다",
    "모바일 환경에서 장바구니 UI가 정상적으로 표시되고 터치 조작이 원활해야 한다",
    "장바구니 API 동시 요청 100건 발생 시 모두 정상 처리되어야 한다",
    "장바구니 데이터는 XSS 공격에 안전하게 인코딩되어 표시되어야 한다"
  ],
  "test_data": [
    {
      "account": "test_user_001",
      "password": "Test1234!",
      "product_id": "PRD-001",
      "product_name": "테스트 상품 A",
      "price": 10000,
      "stock": 100
    },
    {
      "product_id": "PRD-002",
      "product_name": "테스트 상품 B",
      "price": 25000,
      "stock": 5
    },
    {
      "product_id": "PRD-003",
      "product_name": "품절 상품 C",
      "price": 15000,
      "stock": 0,
      "status": "sold_out"
    },
    {
      "invalid_quantity_values": [
        0,
        -1,
        -999,
        "abc",
        "!@#",
        null,
        999999
      ]
    }
  ],
  "traceability": [
    "REQ-CART-001: 상품 상세 페이지에서 장바구니 담기 버튼 클릭 기능",
    "REQ-CART-002: 장바구니에 상품 추가 시 목록에 반영",
    "REQ-CART-003: 동일 상품 재추가 시 수량 증가 처리",
    "REQ-CART-004: 장바구니 페이지에서 상품 수량 변경 기능",
    "REQ-CART-005: 수량 0 또는 삭제 버튼으로 상품 제거",
    "REQ-CART-006: 장바구니 상품 목록 및 수량 정확한 표시",
    "REQ-CART-007: 장바구니 변경사항 실시간 화면 반영",
    "REQ-CART-008: 품절 상품 장바구니 추가 제한",
    "REQ-CART-009: 비정상 수량 입력 방지",
    "REQ-CART-010: 빈 장바구니 상태 메시지 표시"
  ],
  "automation_candidate": true,
  "notes": [
    "장바구니는 매출과 직접 연결되는 핵심 기능으로 P0 우선순위 설정",
    "재고 관리 시스템과의 연동 테스트 필요",
    "품절 상품 처리 로직은 상품 관리 시스템 변경 시 regression 테스트 필수",
    "모바일 앱과 웹의 장바구니 동기화 여부 확인 필요",
    "장바구니 담기 버튼 중복 클릭 방지 처리 확인 필요",
    "프로모션 적용 상품의 경우 할인가 반영 여부 별도 TC 추가 검토",
    "[Regression] 이전 버전에서 장바구니 수량 변경 시 총 금액 계산 오류 발생 이력 있음 - 재발 방지 중점 테스트",
    "세션 타임아웃 시 장바구니 데이터 유지 정책 확인 필요"
  ]
}